{
  "schema_version": "1",
  "host": "claude-code",
  "session_id": "abc123",
  "project_root": "/repo/example-project",
  "manifest_path": "/repo/example-project/.claude/continuity/current.json",
  "trigger": "manual",
  "transcript_source_path": "/Users/example/.claude/projects/example-project/00893aaf.jsonl",
  "transcript_backup_path": "/Users/example/.agents/state/transcripts/example-project/2026-06-02/abc123.jsonl",
  "handoff_mode": "max",
  "handoff_path": "/repo/example-project/local-docs/handoff/2026-06-02-session-handoff.md",
  "restart_supplement_path": "/repo/example-project/.claude/continuity/restart-supplement.md",
  "compact_summary_path": "/repo/example-project/.claude/continuity/compact-summary.md",
  "branch": "feat/continuity-hooks",
  "head": "0123456789abcdef0123456789abcdef01234567",
  "status": "postcompact-ready",
  "updated_at": "2026-06-02T16:20:00Z",
  "notes": [
    "Raw transcript backup is the authority record.",
    "Restart supplement is for quick post-compact pickup only.",
    "Derived handoff should still be verified against current repo truth."
  ]
}
